{
  "schemaVersion": 1,
  "taskKey": "<task-key>",
  "role": "<role-id>",
  "skills": {
    "required": [],
    "conditional": []
  },
  "runtime": {
    "requested": {
      "agent": "claude",
      "model": "<requested-model>",
      "effort": "<requested-effort>"
    },
    "effective": {
      "agent": null,
      "model": null,
      "effort": null
    },
    "verification": {
      "status": "<status>",
      "evidence": "<evidence>; for fallback handling see references/failure-taxonomy.md#access-and-configuration"
    }
  },
  "branch": {
    "base": "<base-branch>",
    "work": "<work-branch>",
    "mergeTarget": "<delivery-branch-or-null>",
    "worktree": "<absolute-path>"
  },
  "artifacts": {
    "briefPath": "<absolute-assembled-brief-path>",
    "reportPath": "<absolute-path>",
    "evidencePath": "<absolute-path>"
  },
  "orca": {
    "runId": null,
    "taskId": null,
    "dispatchId": null
  },
  "status": "planned",
  "fallbackReason": null
}
